### ISSUE TITLE
mupdate not pushing

### ISSUE THREAD

**Issue by 0x00002152** [cyrusimap/cyrus-imapd#3083]
from the mupdate master: 
```
tcpdump: listening on eth1, link-type EN10MB (Ethernet), capture size 262144 bytes
 00:00:00.000000 02:42:a9:fe:43:0b > ff:ff:ff:ff:ff:ff, ethertype ARP (0x0806), length 42: Ethernet (len 6), IPv4 (len 4), Request who-has 169.254.67.10 tell 169.254.67.11, length 28
        0x0000:  0001 0800 0604 0001 0242 a9fe 430b a9fe  .........B..C...
        0x0010:  430b 0000 0000 0000 a9fe 430a            C.........C.
 00:00:00.000036 02:42:a9:fe:43:0a > 02:42:a9:fe:43:0b, ethertype ARP (0x0806), length 42: Ethernet (len 6), IPv4 (len 4), Reply 169.254.67.10 is-at 02:42:a9:fe:43:0a, length 28
        0x0000:  0001 0800 0604 0002 0242 a9fe 430a a9fe  .........B..C...
        0x0010:  430a 0242 a9fe 430b a9fe 430b            C..B..C...C.
 00:00:00.000019 02:42:a9:fe:43:0b > 02:42:a9:fe:43:0a, ethertype IPv4 (0x0800), length 74: (tos 0x0, ttl 64, id 49203, offset 0, flags [DF], proto TCP (6), length 60)
    169.254.67.11.58808 > 169.254.67.10.3905: Flags [S], cksum 0xda40 (incorrect -> 0xa97d), seq 2891423402, win 42340, options [mss 1460,sackOK,TS val 4261994753 ecr 0,nop,wscale 12], length 0
        0x0000:  4500 003c c033 4000 4006 a076 a9fe 430b  E..<.3@.@..v..C.
        0x0010:  a9fe 430a e5b8 0f41 ac57 9eaa 0000 0000  ..C....A.W......
        0x0020:  a002 a564 da40 0000 0204 05b4 0402 080a  ...d.@..........
        0x0030:  fe08 e101 0000 0000 0103 030c            ............
 00:00:00.000043 02:42:a9:fe:43:0a > 02:42:a9:fe:43:0b, ethertype IPv4 (0x0800), length 74: (tos 0x0, ttl 64, id 0, offset 0, flags [DF], proto TCP (6), length 60)
    169.254.67.10.3905 > 169.254.67.11.58808: Flags [S.], cksum 0xda40 (incorrect -> 0xdfff), seq 3037948061, ack 2891423403, win 43440, options [mss 1460,sackOK,TS val 3088248668 ecr 4261994753,nop,wscale 12], length 0
        0x0000:  4500 003c 0000 4000 4006 60aa a9fe 430a  E..<..@.@.`...C.
        0x0010:  a9fe 430b 0f41 e5b8 b513 689d ac57 9eab  ..C..A....h..W..
        0x0020:  a012 a9b0 da40 0000 0204 05b4 0402 080a  .....@..........
        0x0030:  b812 ef5c fe08 e101 0103 030c            ...\........
 00:00:00.000038 02:42:a9:fe:43:0b > 02:42:a9:fe:43:0a, ethertype IPv4 (0x0800), length 66: (tos 0x0, ttl 64, id 49204, offset 0, flags [DF], proto TCP (6), length 52)
    169.254.67.11.58808 > 169.254.67.10.3905: Flags [.], cksum 0xda38 (incorrect -> 0xb876), seq 1, ack 1, win 11, options [nop,nop,TS val 4261994753 ecr 3088248668], length 0
        0x0000:  4500 0034 c034 4000 4006 a07d a9fe 430b  E..4.4@.@..}..C.
        0x0010:  a9fe 430a e5b8 0f41 ac57 9eab b513 689e  ..C....A.W....h.
        0x0020:  8010 000b da38 0000 0101 080a fe08 e101  .....8..........
        0x0030:  b812 ef5c                                ...\
 00:00:00.007413 02:42:a9:fe:43:0a > 02:42:a9:fe:43:0b, ethertype IPv4 (0x0800), length 185: (tos 0x0, ttl 64, id 53918, offset 0, flags [DF], proto TCP (6), length 171)
    169.254.67.10.3905 > 169.254.67.11.58808: Flags [P.], cksum 0xdaaf (incorrect -> 0x3e6e), seq 1:120, ack 1, win 11, options [nop,nop,TS val 3088248676 ecr 4261994753], length 119
        0x0000:  4500 00ab d29e 4000 4006 8d9c a9fe 430a  E.....@.@.....C.
        0x0010:  a9fe 430b 0f41 e5b8 b513 689e ac57 9eab  ..C..A....h..W..
        0x0020:  8018 000b daaf 0000 0101 080a b812 ef64  ...............d
        0x0030:  fe08 e101 2a20 4155 5448 0d0a 2a20 434f  ....*.AUTH..*.CO
        0x0040:  4d50 5245 5353 2022 4445 464c 4154 4522  MPRESS."DEFLATE"
        0x0050:  0d0a 2a20 5041 5254 4941 4c2d 5550 4441  ..*.PARTIAL-UPDA
        0x0060:  5445 0d0a 2a20 4f4b 204d 5550 4441 5445  TE..*.OK.MUPDATE
        0x0070:  2022 6d75 7064 6174 6522 2022 4379 7275  ."mupdate"."Cyru
        0x0080:  7320 494d 4150 2220 2233 2e32 2e31 2d44  s.IMAP"."3.2.1-D
        0x0090:  6562 6961 6e2d 332e 322e 312d 3322 2022  ebian-3.2.1-3"."
        0x00a0:  286d 6173 7465 7229 220d 0a              (master)"..
 00:00:00.000080 02:42:a9:fe:43:0b > 02:42:a9:fe:43:0a, ethertype IPv4 (0x0800), length 66: (tos 0x0, ttl 64, id 49205, offset 0, flags [DF], proto TCP (6), length 52)
    169.254.67.11.58808 > 169.254.67.10.3905: Flags [.], cksum 0xda38 (incorrect -> 0xb7ef), seq 1, ack 120, win 11, options [nop,nop,TS val 4261994761 ecr 3088248676], length 0
        0x0000:  4500 0034 c035 4000 4006 a07c a9fe 430b  E..4.5@.@..|..C.
        0x0010:  a9fe 430a e5b8 0f41 ac57 9eab b513 6915  ..C....A.W....i.
        0x0020:  8010 000b da38 0000 0101 080a fe08 e109  .....8..........
        0x0030:  b812 ef64                                ...d
 00:00:00.004782 02:42:a9:fe:43:0b > 02:42:a9:fe:43:0a, ethertype IPv4 (0x0800), length 78: (tos 0x0, ttl 64, id 49206, offset 0, flags [DF], proto TCP (6), length 64)
    169.254.67.11.58808 > 169.254.67.10.3905: Flags [P.], cksum 0xda44 (incorrect -> 0x3f89), seq 1:13, ack 120, win 11, options [nop,nop,TS val 4261994766 ecr 3088248676], length 12
        0x0000:  4500 0040 c036 4000 4006 a06f a9fe 430b  E..@.6@.@..o..C.
        0x0010:  a9fe 430a e5b8 0f41 ac57 9eab b513 6915  ..C....A.W....i.
        0x0020:  8018 000b da44 0000 0101 080a fe08 e10e  .....D..........
        0x0030:  b812 ef64 5130 3120 4c4f 474f 5554 0d0a  ...dQ01.LOGOUT..
 00:00:00.000046 02:42:a9:fe:43:0a > 02:42:a9:fe:43:0b, ethertype IPv4 (0x0800), length 66: (tos 0x0, ttl 64, id 53919, offset 0, flags [DF], proto TCP (6), length 52)
    169.254.67.10.3905 > 169.254.67.11.58808: Flags [.], cksum 0xda38 (incorrect -> 0xb7d9), seq 120, ack 13, win 11, options [nop,nop,TS val 3088248681 ecr 4261994766], length 0
        0x0000:  4500 0034 d29f 4000 4006 8e12 a9fe 430a  E..4..@.@.....C.
        0x0010:  a9fe 430b 0f41 e5b8 b513 6915 ac57 9eb7  ..C..A....i..W..
        0x0020:  8010 000b da38 0000 0101 080a b812 ef69  .....8.........i
        0x0030:  fe08 e10e                                ....
 00:00:00.001707 02:42:a9:fe:43:0a > 02:42:a9:fe:43:0b, ethertype IPv4 (0x0800), length 84: (tos 0x0, ttl 64, id 53920, offset 0, flags [DF], proto TCP (6), length 70)
    169.254.67.10.3905 > 169.254.67.11.58808: Flags [P.], cksum 0xda4a (incorrect -> 0x29b4), seq 120:138, ack 13, win 11, options [nop,nop,TS val 3088248682 ecr 4261994766], length 18
        0x0000:  4500 0046 d2a0 4000 4006 8dff a9fe 430a  E..F..@.@.....C.
        0x0010:  a9fe 430b 0f41 e5b8 b513 6915 ac57 9eb7  ..C..A....i..W..
        0x0020:  8018 000b da4a 0000 0101 080a b812 ef6a  .....J.........j
        0x0030:  fe08 e10e 5130 3120 4f4b 2022 6279 652d  ....Q01.OK."bye-
        0x0040:  6279 6522 0d0a                           bye"..
 00:00:00.000068 02:42:a9:fe:43:0b > 02:42:a9:fe:43:0a, ethertype IPv4 (0x0800), length 66: (tos 0x0, ttl 64, id 49207, offset 0, flags [DF], proto TCP (6), length 52)
    169.254.67.11.58808 > 169.254.67.10.3905: Flags [.], cksum 0xda38 (incorrect -> 0xb7c4), seq 13, ack 138, win 11, options [nop,nop,TS val 4261994768 ecr 3088248682], length 0
        0x0000:  4500 0034 c037 4000 4006 a07a a9fe 430b  E..4.7@.@..z..C.
        0x0010:  a9fe 430a e5b8 0f41 ac57 9eb7 b513 6927  ..C....A.W....i'
        0x0020:  8010 000b da38 0000 0101 080a fe08 e110  .....8..........
        0x0030:  b812 ef6a                                ...j
 00:00:00.000046 02:42:a9:fe:43:0a > 02:42:a9:fe:43:0b, ethertype IPv4 (0x0800), length 66: (tos 0x0, ttl 64, id 53921, offset 0, flags [DF], proto TCP (6), length 52)
    169.254.67.10.3905 > 169.254.67.11.58808: Flags [F.], cksum 0xda38 (incorrect -> 0xb7c2), seq 138, ack 13, win 11, options [nop,nop,TS val 3088248683 ecr 4261994768], length 0
        0x0000:  4500 0034 d2a1 4000 4006 8e10 a9fe 430a  E..4..@.@.....C.
        0x0010:  a9fe 430b 0f41 e5b8 b513 6927 ac57 9eb7  ..C..A....i'.W..
        0x0020:  8011 000b da38 0000 0101 080a b812 ef6b  .....8.........k
        0x0030:  fe08 e110                                ....
 00:00:00.004566 02:42:a9:fe:43:0b > 02:42:a9:fe:43:0a, ethertype IPv4 (0x0800), length 66: (tos 0x0, ttl 64, id 49208, offset 0, flags [DF], proto TCP (6), length 52)
    169.254.67.11.58808 > 169.254.67.10.3905: Flags [F.], cksum 0xda38 (incorrect -> 0xb7bd), seq 13, ack 139, win 11, options [nop,nop,TS val 4261994772 ecr 3088248683], length 0
        0x0000:  4500 0034 c038 4000 4006 a079 a9fe 430b  E..4.8@.@..y..C.
        0x0010:  a9fe 430a e5b8 0f41 ac57 9eb7 b513 6928  ..C....A.W....i(
        0x0020:  8011 000b da38 0000 0101 080a fe08 e114  .....8..........
        0x0030:  b812 ef6b                                ...k
 00:00:00.000081 02:42:a9:fe:43:0a > 02:42:a9:fe:43:0b, ethertype IPv4 (0x0800), length 66: (tos 0x0, ttl 64, id 53922, offset 0, flags [DF], proto TCP (6), length 52)
    169.254.67.10.3905 > 169.254.67.11.58808: Flags [.], cksum 0xda38 (incorrect -> 0xb7b9), seq 139, ack 14, win 11, options [nop,nop,TS val 3088248687 ecr 4261994772], length 0
        0x0000:  4500 0034 d2a2 4000 4006 8e0f a9fe 430a  E..4..@.@.....C.
        0x0010:  a9fe 430b 0f41 e5b8 b513 6928 ac57 9eb8  ..C..A....i(.W..
        0x0020:  8010 000b da38 0000 0101 080a b812 ef6f  .....8.........o
        0x0030:  fe08 e114                                ....
 00:00:01.086020 02:42:a9:fe:43:0b > 02:42:a9:fe:43:0a, ethertype IPv4 (0x0800), length 74: (tos 0x0, ttl 64, id 23257, offset 0, flags [DF], proto TCP (6), length 60)
    169.254.67.11.58858 > 169.254.67.10.3905: Flags [S], cksum 0xda40 (incorrect -> 0x0f8e), seq 1362071359, win 42340, options [mss 1460,sackOK,TS val 4261995858 ecr 0,nop,wscale 12], length 0
        0x0000:  4500 003c 5ad9 4000 4006 05d1 a9fe 430b  E..<Z.@.@.....C.
        0x0010:  a9fe 430a e5ea 0f41 512f 8f3f 0000 0000  ..C....AQ/.?....
        0x0020:  a002 a564 da40 0000 0204 05b4 0402 080a  ...d.@..........
        0x0030:  fe08 e552 0000 0000 0103 030c            ...R........
 00:00:00.000051 02:42:a9:fe:43:0a > 02:42:a9:fe:43:0b, ethertype IPv4 (0x0800), length 74: (tos 0x0, ttl 64, id 0, offset 0, flags [DF], proto TCP (6), length 60)
    169.254.67.10.3905 > 169.254.67.11.58858: Flags [S.], cksum 0xda40 (incorrect -> 0x2afb), seq 2740293919, ack 1362071360, win 43440, options [mss 1460,sackOK,TS val 3088249773 ecr 4261995858,nop,wscale 12], length 0
        0x0000:  4500 003c 0000 4000 4006 60aa a9fe 430a  E..<..@.@.`...C.
        0x0010:  a9fe 430b 0f41 e5ea a355 911f 512f 8f40  ..C..A...U..Q/.@
        0x0020:  a012 a9b0 da40 0000 0204 05b4 0402 080a  .....@..........
        0x0030:  b812 f3ad fe08 e552 0103 030c            .......R....
 00:00:00.000029 02:42:a9:fe:43:0b > 02:42:a9:fe:43:0a, ethertype IPv4 (0x0800), length 66: (tos 0x0, ttl 64, id 23258, offset 0, flags [DF], proto TCP (6), length 52)
    169.254.67.11.58858 > 169.254.67.10.3905: Flags [.], cksum 0xda38 (incorrect -> 0x0372), seq 1, ack 1, win 11, options [nop,nop,TS val 4261995858 ecr 3088249773], length 0
        0x0000:  4500 0034 5ada 4000 4006 05d8 a9fe 430b  E..4Z.@.@.....C.
        0x0010:  a9fe 430a e5ea 0f41 512f 8f40 a355 9120  ..C....AQ/.@.U..
        0x0020:  8010 000b da38 0000 0101 080a fe08 e552  .....8.........R
        0x0030:  b812 f3ad                                ....
 00:00:00.002101 02:42:a9:fe:43:0a > 02:42:a9:fe:43:0b, ethertype IPv4 (0x0800), length 185: (tos 0x0, ttl 64, id 29318, offset 0, flags [DF], proto TCP (6), length 171)
    169.254.67.10.3905 > 169.254.67.11.58858: Flags [P.], cksum 0xdaaf (incorrect -> 0x896f), seq 1:120, ack 1, win 11, options [nop,nop,TS val 3088249775 ecr 4261995858], length 119
        0x0000:  4500 00ab 7286 4000 4006 edb4 a9fe 430a  E...r.@.@.....C.
        0x0010:  a9fe 430b 0f41 e5ea a355 9120 512f 8f40  ..C..A...U..Q/.@
        0x0020:  8018 000b daaf 0000 0101 080a b812 f3af  ................
        0x0030:  fe08 e552 2a20 4155 5448 0d0a 2a20 434f  ...R*.AUTH..*.CO
        0x0040:  4d50 5245 5353 2022 4445 464c 4154 4522  MPRESS."DEFLATE"
        0x0050:  0d0a 2a20 5041 5254 4941 4c2d 5550 4441  ..*.PARTIAL-UPDA
        0x0060:  5445 0d0a 2a20 4f4b 204d 5550 4441 5445  TE..*.OK.MUPDATE
        0x0070:  2022 6d75 7064 6174 6522 2022 4379 7275  ."mupdate"."Cyru
        0x0080:  7320 494d 4150 2220 2233 2e32 2e31 2d44  s.IMAP"."3.2.1-D
        0x0090:  6562 6961 6e2d 332e 322e 312d 3322 2022  ebian-3.2.1-3"."
        0x00a0:  286d 6173 7465 7229 220d 0a              (master)"..
 00:00:00.000713 02:42:a9:fe:43:0b > 02:42:a9:fe:43:0a, ethertype IPv4 (0x0800), length 66: (tos 0x0, ttl 64, id 23259, offset 0, flags [DF], proto TCP (6), length 52)
    169.254.67.11.58858 > 169.254.67.10.3905: Flags [.], cksum 0xda38 (incorrect -> 0x02f6), seq 1, ack 120, win 11, options [nop,nop,TS val 4261995861 ecr 3088249775], length 0
        0x0000:  4500 0034 5adb 4000 4006 05d7 a9fe 430b  E..4Z.@.@.....C.
        0x0010:  a9fe 430a e5ea 0f41 512f 8f40 a355 9197  ..C....AQ/.@.U..
        0x0020:  8010 000b da38 0000 0101 080a fe08 e555  .....8.........U
        0x0030:  b812 f3af                                ....
 00:00:00.001301 02:42:a9:fe:43:0b > 02:42:a9:fe:43:0a, ethertype IPv4 (0x0800), length 78: (tos 0x0, ttl 64, id 23260, offset 0, flags [DF], proto TCP (6), length 64)
    169.254.67.11.58858 > 169.254.67.10.3905: Flags [P.], cksum 0xda44 (incorrect -> 0x8a93), seq 1:13, ack 120, win 11, options [nop,nop,TS val 4261995862 ecr 3088249775], length 12
        0x0000:  4500 0040 5adc 4000 4006 05ca a9fe 430b  E..@Z.@.@.....C.
        0x0010:  a9fe 430a e5ea 0f41 512f 8f40 a355 9197  ..C....AQ/.@.U..
        0x0020:  8018 000b da44 0000 0101 080a fe08 e556  .....D.........V
        0x0030:  b812 f3af 5130 3120 4c4f 474f 5554 0d0a  ....Q01.LOGOUT..
 00:00:00.000020 02:42:a9:fe:43:0a > 02:42:a9:fe:43:0b, ethertype IPv4 (0x0800), length 66: (tos 0x0, ttl 64, id 29319, offset 0, flags [DF], proto TCP (6), length 52)
    169.254.67.10.3905 > 169.254.67.11.58858: Flags [.], cksum 0xda38 (incorrect -> 0x02e6), seq 120, ack 13, win 11, options [nop,nop,TS val 3088249778 ecr 4261995862], length 0
        0x0000:  4500 0034 7287 4000 4006 ee2a a9fe 430a  E..4r.@.@..*..C.
        0x0010:  a9fe 430b 0f41 e5ea a355 9197 512f 8f4c  ..C..A...U..Q/.L
        0x0020:  8010 000b da38 0000 0101 080a b812 f3b2  .....8..........
        0x0030:  fe08 e556                                ...V
 00:00:00.000114 02:42:a9:fe:43:0a > 02:42:a9:fe:43:0b, ethertype IPv4 (0x0800), length 84: (tos 0x0, ttl 64, id 29320, offset 0, flags [DF], proto TCP (6), length 70)
    169.254.67.10.3905 > 169.254.67.11.58858: Flags [P.], cksum 0xda4a (incorrect -> 0x74c1), seq 120:138, ack 13, win 11, options [nop,nop,TS val 3088249778 ecr 4261995862], length 18
        0x0000:  4500 0046 7288 4000 4006 ee17 a9fe 430a  E..Fr.@.@.....C.
        0x0010:  a9fe 430b 0f41 e5ea a355 9197 512f 8f4c  ..C..A...U..Q/.L
        0x0020:  8018 000b da4a 0000 0101 080a b812 f3b2  .....J..........
        0x0030:  fe08 e556 5130 3120 4f4b 2022 6279 652d  ...VQ01.OK."bye-
        0x0040:  6279 6522 0d0a                           bye"..
 00:00:00.000046 02:42:a9:fe:43:0a > 02:42:a9:fe:43:0b, ethertype IPv4 (0x0800), length 66: (tos 0x0, ttl 64, id 29321, offset 0, flags [DF], proto TCP (6), length 52)
    169.254.67.10.3905 > 169.254.67.11.58858: Flags [F.], cksum 0xda38 (incorrect -> 0x02d3), seq 138, ack 13, win 11, options [nop,nop,TS val 3088249778 ecr 4261995862], length 0
        0x0000:  4500 0034 7289 4000 4006 ee28 a9fe 430a  E..4r.@.@..(..C.
        0x0010:  a9fe 430b 0f41 e5ea a355 91a9 512f 8f4c  ..C..A...U..Q/.L
        0x0020:  8011 000b da38 0000 0101 080a b812 f3b2  .....8..........
        0x0030:  fe08 e556                                ...V
 00:00:00.000037 02:42:a9:fe:43:0b > 02:42:a9:fe:43:0a, ethertype IPv4 (0x0800), length 66: (tos 0x0, ttl 64, id 23261, offset 0, flags [DF], proto TCP (6), length 52)
    169.254.67.11.58858 > 169.254.67.10.3905: Flags [.], cksum 0xda38 (incorrect -> 0x02d3), seq 13, ack 138, win 11, options [nop,nop,TS val 4261995863 ecr 3088249778], length 0
        0x0000:  4500 0034 5add 4000 4006 05d5 a9fe 430b  E..4Z.@.@.....C.
        0x0010:  a9fe 430a e5ea 0f41 512f 8f4c a355 91a9  ..C....AQ/.L.U..
        0x0020:  8010 000b da38 0000 0101 080a fe08 e557  .....8.........W
        0x0030:  b812 f3b2                                ....
 00:00:00.000056 02:42:a9:fe:43:0b > 02:42:a9:fe:43:0a, ethertype IPv4 (0x0800), length 66: (tos 0x0, ttl 64, id 23262, offset 0, flags [DF], proto TCP (6), length 52)
    169.254.67.11.58858 > 169.254.67.10.3905: Flags [F.], cksum 0xda38 (incorrect -> 0x02d1), seq 13, ack 139, win 11, options [nop,nop,TS val 4261995863 ecr 3088249778], length 0
        0x0000:  4500 0034 5ade 4000 4006 05d4 a9fe 430b  E..4Z.@.@.....C.
        0x0010:  a9fe 430a e5ea 0f41 512f 8f4c a355 91aa  ..C....AQ/.L.U..
        0x0020:  8011 000b da38 0000 0101 080a fe08 e557  .....8.........W
        0x0030:  b812 f3b2                                ....
 00:00:00.000011 02:42:a9:fe:43:0a > 02:42:a9:fe:43:0b, ethertype IPv4 (0x0800), length 66: (tos 0x0, ttl 64, id 29322, offset 0, flags [DF], proto TCP (6), length 52)
    169.254.67.10.3905 > 169.254.67.11.58858: Flags [.], cksum 0xda38 (incorrect -> 0x02d1), seq 139, ack 14, win 11, options [nop,nop,TS val 3088249778 ecr 4261995863], length 0
        0x0000:  4500 0034 728a 4000 4006 ee27 a9fe 430a  E..4r.@.@..'..C.
        0x0010:  a9fe 430b 0f41 e5ea a355 91aa 512f 8f4d  ..C..A...U..Q/.M
        0x0020:  8010 000b da38 0000 0101 080a b812 f3b2  .....8..........
        0x0030:  fe08 e557                                ...W
 00:00:02.092304 02:42:a9:fe:43:0b > 02:42:a9:fe:43:0a, ethertype IPv4 (0x0800), length 74: (tos 0x0, ttl 64, id 14748, offset 0, flags [DF], proto TCP (6), length 60)
    169.254.67.11.58928 > 169.254.67.10.3905: Flags [S], cksum 0xda40 (incorrect -> 0x59d2), seq 412579100, win 42340, options [mss 1460,sackOK,TS val 4261997955 ecr 0,nop,wscale 12], length 0
        0x0000:  4500 003c 399c 4000 4006 270e a9fe 430b  E..<9.@.@.'...C.
        0x0010:  a9fe 430a e630 0f41 1897 751c 0000 0000  ..C..0.A..u.....
        0x0020:  a002 a564 da40 0000 0204 05b4 0402 080a  ...d.@..........
        0x0030:  fe08 ed83 0000 0000 0103 030c            ............
 00:00:00.000051 02:42:a9:fe:43:0a > 02:42:a9:fe:43:0b, ethertype IPv4 (0x0800), length 74: (tos 0x0, ttl 64, id 0, offset 0, flags [DF], proto TCP (6), length 60)
    169.254.67.10.3905 > 169.254.67.11.58928: Flags [S.], cksum 0xda40 (incorrect -> 0xfdf8), seq 2913007081, ack 412579101, win 43440, options [mss 1460,sackOK,TS val 3088251870 ecr 4261997955,nop,wscale 12], length 0
        0x0000:  4500 003c 0000 4000 4006 60aa a9fe 430a  E..<..@.@.`...C.
        0x0010:  a9fe 430b 0f41 e630 ada0 f5e9 1897 751d  ..C..A.0......u.
        0x0020:  a012 a9b0 da40 0000 0204 05b4 0402 080a  .....@..........
        0x0030:  b812 fbde fe08 ed83 0103 030c            ............
 00:00:00.000031 02:42:a9:fe:43:0b > 02:42:a9:fe:43:0a, ethertype IPv4 (0x0800), length 66: (tos 0x0, ttl 64, id 14749, offset 0, flags [DF], proto TCP (6), length 52)
    169.254.67.11.58928 > 169.254.67.10.3905: Flags [.], cksum 0xda38 (incorrect -> 0xd66f), seq 1, ack 1, win 11, options [nop,nop,TS val 4261997955 ecr 3088251870], length 0
        0x0000:  4500 0034 399d 4000 4006 2715 a9fe 430b  E..49.@.@.'...C.
        0x0010:  a9fe 430a e630 0f41 1897 751d ada0 f5ea  ..C..0.A..u.....
        0x0020:  8010 000b da38 0000 0101 080a fe08 ed83  .....8..........
        0x0030:  b812 fbde                                ....
 00:00:00.001101 02:42:a9:fe:43:0a > 02:42:a9:fe:43:0b, ethertype IPv4 (0x0800), length 185: (tos 0x0, ttl 64, id 25959, offset 0, flags [DF], proto TCP (6), length 171)
    169.254.67.10.3905 > 169.254.67.11.58928: Flags [P.], cksum 0xdaaf (incorrect -> 0x5c6e), seq 1:120, ack 1, win 11, options [nop,nop,TS val 3088251871 ecr 4261997955], length 119
        0x0000:  4500 00ab 6567 4000 4006 fad3 a9fe 430a  E...eg@.@.....C.
        0x0010:  a9fe 430b 0f41 e630 ada0 f5ea 1897 751d  ..C..A.0......u.
        0x0020:  8018 000b daaf 0000 0101 080a b812 fbdf  ................
        0x0030:  fe08 ed83 2a20 4155 5448 0d0a 2a20 434f  ....*.AUTH..*.CO
        0x0040:  4d50 5245 5353 2022 4445 464c 4154 4522  MPRESS."DEFLATE"
        0x0050:  0d0a 2a20 5041 5254 4941 4c2d 5550 4441  ..*.PARTIAL-UPDA
        0x0060:  5445 0d0a 2a20 4f4b 204d 5550 4441 5445  TE..*.OK.MUPDATE
        0x0070:  2022 6d75 7064 6174 6522 2022 4379 7275  ."mupdate"."Cyru
        0x0080:  7320 494d 4150 2220 2233 2e32 2e31 2d44  s.IMAP"."3.2.1-D
        0x0090:  6562 6961 6e2d 332e 322e 312d 3322 2022  ebian-3.2.1-3"."
        0x00a0:  286d 6173 7465 7229 220d 0a              (master)"..
 00:00:00.000040 02:42:a9:fe:43:0b > 02:42:a9:fe:43:0a, ethertype IPv4 (0x0800), length 66: (tos 0x0, ttl 64, id 14750, offset 0, flags [DF], proto TCP (6), length 52)
    169.254.67.11.58928 > 169.254.67.10.3905: Flags [.], cksum 0xda38 (incorrect -> 0xd5f6), seq 1, ack 120, win 11, options [nop,nop,TS val 4261997956 ecr 3088251871], length 0
        0x0000:  4500 0034 399e 4000 4006 2714 a9fe 430b  E..49.@.@.'...C.
        0x0010:  a9fe 430a e630 0f41 1897 751d ada0 f661  ..C..0.A..u....a
        0x0020:  8010 000b da38 0000 0101 080a fe08 ed84  .....8..........
        0x0030:  b812 fbdf                                ....
 00:00:00.001418 02:42:a9:fe:43:0b > 02:42:a9:fe:43:0a, ethertype IPv4 (0x0800), length 78: (tos 0x0, ttl 64, id 14751, offset 0, flags [DF], proto TCP (6), length 64)
    169.254.67.11.58928 > 169.254.67.10.3905: Flags [P.], cksum 0xda44 (incorrect -> 0x5d93), seq 1:13, ack 120, win 11, options [nop,nop,TS val 4261997958 ecr 3088251871], length 12
        0x0000:  4500 0040 399f 4000 4006 2707 a9fe 430b  E..@9.@.@.'...C.
        0x0010:  a9fe 430a e630 0f41 1897 751d ada0 f661  ..C..0.A..u....a
        0x0020:  8018 000b da44 0000 0101 080a fe08 ed86  .....D..........
        0x0030:  b812 fbdf 5130 3120 4c4f 474f 5554 0d0a  ....Q01.LOGOUT..
 00:00:00.000026 02:42:a9:fe:43:0a > 02:42:a9:fe:43:0b, ethertype IPv4 (0x0800), length 66: (tos 0x0, ttl 64, id 25960, offset 0, flags [DF], proto TCP (6), length 52)
    169.254.67.10.3905 > 169.254.67.11.58928: Flags [.], cksum 0xda38 (incorrect -> 0xd5e6), seq 120, ack 13, win 11, options [nop,nop,TS val 3088251873 ecr 4261997958], length 0
        0x0000:  4500 0034 6568 4000 4006 fb49 a9fe 430a  E..4eh@.@..I..C.
        0x0010:  a9fe 430b 0f41 e630 ada0 f661 1897 7529  ..C..A.0...a..u)
        0x0020:  8010 000b da38 0000 0101 080a b812 fbe1  .....8..........
        0x0030:  fe08 ed86                                ....
 00:00:00.000235 02:42:a9:fe:43:0a > 02:42:a9:fe:43:0b, ethertype IPv4 (0x0800), length 84: (tos 0x0, ttl 64, id 25961, offset 0, flags [DF], proto TCP (6), length 70)
    169.254.67.10.3905 > 169.254.67.11.58928: Flags [P.], cksum 0xda4a (incorrect -> 0x47c2), seq 120:138, ack 13, win 11, options [nop,nop,TS val 3088251873 ecr 4261997958], length 18
        0x0000:  4500 0046 6569 4000 4006 fb36 a9fe 430a  E..Fei@.@..6..C.
        0x0010:  a9fe 430b 0f41 e630 ada0 f661 1897 7529  ..C..A.0...a..u)
        0x0020:  8018 000b da4a 0000 0101 080a b812 fbe1  .....J..........
        0x0030:  fe08 ed86 5130 3120 4f4b 2022 6279 652d  ....Q01.OK."bye-
        0x0040:  6279 6522 0d0a                           bye"..
 00:00:00.000021 02:42:a9:fe:43:0b > 02:42:a9:fe:43:0a, ethertype IPv4 (0x0800), length 66: (tos 0x0, ttl 64, id 14752, offset 0, flags [DF], proto TCP (6), length 52)
    169.254.67.11.58928 > 169.254.67.10.3905: Flags [.], cksum 0xda38 (incorrect -> 0xd5d4), seq 13, ack 138, win 11, options [nop,nop,TS val 4261997958 ecr 3088251873], length 0
        0x0000:  4500 0034 39a0 4000 4006 2712 a9fe 430b  E..49.@.@.'...C.
        0x0010:  a9fe 430a e630 0f41 1897 7529 ada0 f673  ..C..0.A..u)...s
        0x0020:  8010 000b da38 0000 0101 080a fe08 ed86  .....8..........
        0x0030:  b812 fbe1                                ....
 00:00:00.000025 02:42:a9:fe:43:0a > 02:42:a9:fe:43:0b, ethertype IPv4 (0x0800), length 66: (tos 0x0, ttl 64, id 25962, offset 0, flags [DF], proto TCP (6), length 52)
    169.254.67.10.3905 > 169.254.67.11.58928: Flags [F.], cksum 0xda38 (incorrect -> 0xd5d3), seq 138, ack 13, win 11, options [nop,nop,TS val 3088251873 ecr 4261997958], length 0
        0x0000:  4500 0034 656a 4000 4006 fb47 a9fe 430a  E..4ej@.@..G..C.
        0x0010:  a9fe 430b 0f41 e630 ada0 f673 1897 7529  ..C..A.0...s..u)
        0x0020:  8011 000b da38 0000 0101 080a b812 fbe1  .....8..........
        0x0030:  fe08 ed86                                ....
 00:00:00.000018 02:42:a9:fe:43:0b > 02:42:a9:fe:43:0a, ethertype IPv4 (0x0800), length 66: (tos 0x0, ttl 64, id 14753, offset 0, flags [DF], proto TCP (6), length 52)
    169.254.67.11.58928 > 169.254.67.10.3905: Flags [F.], cksum 0xda38 (incorrect -> 0xd5d2), seq 13, ack 139, win 11, options [nop,nop,TS val 4261997958 ecr 3088251873], length 0
        0x0000:  4500 0034 39a1 4000 4006 2711 a9fe 430b  E..49.@.@.'...C.
        0x0010:  a9fe 430a e630 0f41 1897 7529 ada0 f674  ..C..0.A..u)...t
        0x0020:  8011 000b da38 0000 0101 080a fe08 ed86  .....8..........
        0x0030:  b812 fbe1                                ....
 00:00:00.000011 02:42:a9:fe:43:0a > 02:42:a9:fe:43:0b, ethertype IPv4 (0x0800), length 66: (tos 0x0, ttl 64, id 25963, offset 0, flags [DF], proto TCP (6), length 52)
    169.254.67.10.3905 > 169.254.67.11.58928: Flags [.], cksum 0xda38 (incorrect -> 0xd5d2), seq 139, ack 14, win 11, options [nop,nop,TS val 3088251873 ecr 4261997958], length 0
        0x0000:  4500 0034 656b 4000 4006 fb46 a9fe 430a  E..4ek@.@..F..C.
        0x0010:  a9fe 430b 0f41 e630 ada0 f674 1897 752a  ..C..A.0...t..u*
        0x0020:  8010 000b da38 0000 0101 080a b812 fbe1  .....8..........
        0x0030:  fe08 ed86                                ....
 00:00:03.125712 02:42:a9:fe:43:0b > 02:42:a9:fe:43:0a, ethertype IPv4 (0x0800), length 74: (tos 0x0, ttl 64, id 33125, offset 0, flags [DF], proto TCP (6), length 60)
    169.254.67.11.59026 > 169.254.67.10.3905: Flags [S], cksum 0xda40 (incorrect -> 0xd53e), seq 3853000707, win 42340, options [mss 1460,sackOK,TS val 4262001084 ecr 0,nop,wscale 12], length 0
        0x0000:  4500 003c 8165 4000 4006 df44 a9fe 430b  E..<.e@.@..D..C.
        0x0010:  a9fe 430a e692 0f41 e5a8 2003 0000 0000  ..C....A........
        0x0020:  a002 a564 da40 0000 0204 05b4 0402 080a  ...d.@..........
        0x0030:  fe08 f9bc 0000 0000 0103 030c            ............
 00:00:00.000067 02:42:a9:fe:43:0a > 02:42:a9:fe:43:0b, ethertype IPv4 (0x0800), length 74: (tos 0x0, ttl 64, id 0, offset 0, flags [DF], proto TCP (6), length 60)
    169.254.67.10.3905 > 169.254.67.11.59026: Flags [S.], cksum 0xda40 (incorrect -> 0x7976), seq 2162103905, ack 3853000708, win 43440, options [mss 1460,sackOK,TS val 3088254999 ecr 4262001084,nop,wscale 12], length 0
        0x0000:  4500 003c 0000 4000 4006 60aa a9fe 430a  E..<..@.@.`...C.
        0x0010:  a9fe 430b 0f41 e692 80df 1661 e5a8 2004  ..C..A.....a....
        0x0020:  a012 a9b0 da40 0000 0204 05b4 0402 080a  .....@..........
        0x0030:  b813 0817 fe08 f9bc 0103 030c            ............
 00:00:00.000044 02:42:a9:fe:43:0b > 02:42:a9:fe:43:0a, ethertype IPv4 (0x0800), length 66: (tos 0x0, ttl 64, id 33126, offset 0, flags [DF], proto TCP (6), length 52)
    169.254.67.11.59026 > 169.254.67.10.3905: Flags [.], cksum 0xda38 (incorrect -> 0x51ed), seq 1, ack 1, win 11, options [nop,nop,TS val 4262001084 ecr 3088254999], length 0
        0x0000:  4500 0034 8166 4000 4006 df4b a9fe 430b  E..4.f@.@..K..C.
        0x0010:  a9fe 430a e692 0f41 e5a8 2004 80df 1662  ..C....A.......b
        0x0020:  8010 000b da38 0000 0101 080a fe08 f9bc  .....8..........
        0x0030:  b813 0817                                ....
 00:00:00.002212 02:42:a9:fe:43:0a > 02:42:a9:fe:43:0b, ethertype IPv4 (0x0800), length 185: (tos 0x0, ttl 64, id 22529, offset 0, flags [DF], proto TCP (6), length 171)
    169.254.67.10.3905 > 169.254.67.11.59026: Flags [P.], cksum 0xdaaf (incorrect -> 0xd7ea), seq 1:120, ack 1, win 11, options [nop,nop,TS val 3088255001 ecr 4262001084], length 119
        0x0000:  4500 00ab 5801 4000 4006 083a a9fe 430a  E...X.@.@..:..C.
        0x0010:  a9fe 430b 0f41 e692 80df 1662 e5a8 2004  ..C..A.....b....
        0x0020:  8018 000b daaf 0000 0101 080a b813 0819  ................
        0x0030:  fe08 f9bc 2a20 4155 5448 0d0a 2a20 434f  ....*.AUTH..*.CO
        0x0040:  4d50 5245 5353 2022 4445 464c 4154 4522  MPRESS."DEFLATE"
        0x0050:  0d0a 2a20 5041 5254 4941 4c2d 5550 4441  ..*.PARTIAL-UPDA
        0x0060:  5445 0d0a 2a20 4f4b 204d 5550 4441 5445  TE..*.OK.MUPDATE
        0x0070:  2022 6d75 7064 6174 6522 2022 4379 7275  ."mupdate"."Cyru
        0x0080:  7320 494d 4150 2220 2233 2e32 2e31 2d44  s.IMAP"."3.2.1-D
        0x0090:  6562 6961 6e2d 332e 322e 312d 3322 2022  ebian-3.2.1-3"."
        0x00a0:  286d 6173 7465 7229 220d 0a              (master)"..
 00:00:00.000057 02:42:a9:fe:43:0b > 02:42:a9:fe:43:0a, ethertype IPv4 (0x0800), length 66: (tos 0x0, ttl 64, id 33127, offset 0, flags [DF], proto TCP (6), length 52)
    169.254.67.11.59026 > 169.254.67.10.3905: Flags [.], cksum 0xda38 (incorrect -> 0x5172), seq 1, ack 120, win 11, options [nop,nop,TS val 4262001086 ecr 3088255001], length 0
        0x0000:  4500 0034 8167 4000 4006 df4a a9fe 430b  E..4.g@.@..J..C.
        0x0010:  a9fe 430a e692 0f41 e5a8 2004 80df 16d9  ..C....A........
        0x0020:  8010 000b da38 0000 0101 080a fe08 f9be  .....8..........
        0x0030:  b813 0819                                ....
 00:00:00.002141 02:42:a9:fe:43:0b > 02:42:a9:fe:43:0a, ethertype IPv4 (0x0800), length 78: (tos 0x0, ttl 64, id 33128, offset 0, flags [DF], proto TCP (6), length 64)
    169.254.67.11.59026 > 169.254.67.10.3905: Flags [P.], cksum 0xda44 (incorrect -> 0xd90e), seq 1:13, ack 120, win 11, options [nop,nop,TS val 4262001088 ecr 3088255001], length 12
        0x0000:  4500 0040 8168 4000 4006 df3d a9fe 430b  E..@.h@.@..=..C.
        0x0010:  a9fe 430a e692 0f41 e5a8 2004 80df 16d9  ..C....A........
        0x0020:  8018 000b da44 0000 0101 080a fe08 f9c0  .....D..........
        0x0030:  b813 0819 5130 3120 4c4f 474f 5554 0d0a  ....Q01.LOGOUT..
 00:00:00.000030 02:42:a9:fe:43:0a > 02:42:a9:fe:43:0b, ethertype IPv4 (0x0800), length 66: (tos 0x0, ttl 64, id 22530, offset 0, flags [DF], proto TCP (6), length 52)
    169.254.67.10.3905 > 169.254.67.11.59026: Flags [.], cksum 0xda38 (incorrect -> 0x5162), seq 120, ack 13, win 11, options [nop,nop,TS val 3088255003 ecr 4262001088], length 0
        0x0000:  4500 0034 5802 4000 4006 08b0 a9fe 430a  E..4X.@.@.....C.
        0x0010:  a9fe 430b 0f41 e692 80df 16d9 e5a8 2010  ..C..A..........
        0x0020:  8010 000b da38 0000 0101 080a b813 081b  .....8..........
        0x0030:  fe08 f9c0                                ....
 00:00:00.000113 02:42:a9:fe:43:0a > 02:42:a9:fe:43:0b, ethertype IPv4 (0x0800), length 84: (tos 0x0, ttl 64, id 22531, offset 0, flags [DF], proto TCP (6), length 70)
    169.254.67.10.3905 > 169.254.67.11.59026: Flags [P.], cksum 0xda4a (incorrect -> 0xc33d), seq 120:138, ack 13, win 11, options [nop,nop,TS val 3088255003 ecr 4262001088], length 18
        0x0000:  4500 0046 5803 4000 4006 089d a9fe 430a  E..FX.@.@.....C.
        0x0010:  a9fe 430b 0f41 e692 80df 16d9 e5a8 2010  ..C..A..........
        0x0020:  8018 000b da4a 0000 0101 080a b813 081b  .....J..........
        0x0030:  fe08 f9c0 5130 3120 4f4b 2022 6279 652d  ....Q01.OK."bye-
        0x0040:  6279 6522 0d0a                           bye"..
 00:00:00.000026 02:42:a9:fe:43:0a > 02:42:a9:fe:43:0b, ethertype IPv4 (0x0800), length 66: (tos 0x0, ttl 64, id 22532, offset 0, flags [DF], proto TCP (6), length 52)
    169.254.67.10.3905 > 169.254.67.11.59026: Flags [F.], cksum 0xda38 (incorrect -> 0x514f), seq 138, ack 13, win 11, options [nop,nop,TS val 3088255003 ecr 4262001088], length 0
        0x0000:  4500 0034 5804 4000 4006 08ae a9fe 430a  E..4X.@.@.....C.
        0x0010:  a9fe 430b 0f41 e692 80df 16eb e5a8 2010  ..C..A..........
        0x0020:  8011 000b da38 0000 0101 080a b813 081b  .....8..........
        0x0030:  fe08 f9c0                                ....
 00:00:00.000043 02:42:a9:fe:43:0b > 02:42:a9:fe:43:0a, ethertype IPv4 (0x0800), length 66: (tos 0x0, ttl 64, id 33129, offset 0, flags [DF], proto TCP (6), length 52)
    169.254.67.11.59026 > 169.254.67.10.3905: Flags [.], cksum 0xda38 (incorrect -> 0x5150), seq 13, ack 138, win 11, options [nop,nop,TS val 4262001088 ecr 3088255003], length 0
        0x0000:  4500 0034 8169 4000 4006 df48 a9fe 430b  E..4.i@.@..H..C.
        0x0010:  a9fe 430a e692 0f41 e5a8 2010 80df 16eb  ..C....A........
        0x0020:  8010 000b da38 0000 0101 080a fe08 f9c0  .....8..........
        0x0030:  b813 081b                                ....
 00:00:00.000084 02:42:a9:fe:43:0b > 02:42:a9:fe:43:0a, ethertype IPv4 (0x0800), length 66: (tos 0x0, ttl 64, id 33130, offset 0, flags [DF], proto TCP (6), length 52)
    169.254.67.11.59026 > 169.254.67.10.3905: Flags [F.], cksum 0xda38 (incorrect -> 0x514d), seq 13, ack 139, win 11, options [nop,nop,TS val 4262001089 ecr 3088255003], length 0
        0x0000:  4500 0034 816a 4000 4006 df47 a9fe 430b  E..4.j@.@..G..C.
        0x0010:  a9fe 430a e692 0f41 e5a8 2010 80df 16ec  ..C....A........
        0x0020:  8011 000b da38 0000 0101 080a fe08 f9c1  .....8..........
        0x0030:  b813 081b                                ....
 00:00:00.000013 02:42:a9:fe:43:0a > 02:42:a9:fe:43:0b, ethertype IPv4 (0x0800), length 66: (tos 0x0, ttl 64, id 22533, offset 0, flags [DF], proto TCP (6), length 52)
    169.254.67.10.3905 > 169.254.67.11.59026: Flags [.], cksum 0xda38 (incorrect -> 0x514c), seq 139, ack 14, win 11, options [nop,nop,TS val 3088255004 ecr 4262001089], length 0
        0x0000:  4500 0034 5805 4000 4006 08ad a9fe 430a  E..4X.@.@.....C.
        0x0010:  a9fe 430b 0f41 e692 80df 16ec e5a8 2011  ..C..A..........
        0x0020:  8010 000b da38 0000 0101 080a b813 081c  .....8..........
        0x0030:  fe08 f9c1                                ....

```

no log info on the master, had to get packet dump on the backend slave it actually says "can't push to backend" which is ambiguous because IT is the backend so shouldn't the error be "can't push to master" or something, since it's not pushing to the "frontend" either because thats a completely different concept as well?

```
murder-be_1  | 2020-06-27 22:52:39,713 INFO success: rsyslog entered RUNNING state, process has stayed up for > than 5 seconds (startsecs)
murder-be_1  | 2020-06-27 22:52:41,718 INFO spawned: 'cyrmaster' with pid 31
murder-be_1  | Jun 27 22:52:41 murder-be cyrus/ctl_cyrusdb[32]: skiplist: clean shutdown file missing, updating recovery stamp
murder-be_1  | Jun 27 22:52:41 murder-be cyrus/ctl_cyrusdb[32]: recovering cyrus databases
murder-be_1  | Jun 27 22:52:41 murder-be cyrus/ctl_cyrusdb[32]: done recovering cyrus databases
murder-be_1  | Jun 27 22:52:41 murder-be cyrus/ctl_mboxlist[35]: ldapdb
murder-be_1  | Jun 27 22:52:41 murder-be cyrus/ctl_mboxlist[35]: populating mupdate
murder-be_1  | Jun 27 22:52:41 murder-be cyrus/ctl_mboxlist[35]: couldn't authenticate to backend server: no mechanism available
murder-be_1  | Jun 27 22:52:41 murder-be cyrus/ctl_mboxlist[35]: mupdate_connect failed: no auth status
murder-be_1  | Jun 27 22:52:41 murder-be master[31]: process type:START name:mupdatepush path:/usr/sbin/cyrus age:0.000s pid:35 exited, status 1
murder-be_1  | Jun 27 22:52:41 murder-be master[31]: can't run startup
murder-be_1  | Jun 27 22:52:41 murder-be master[31]: exiting
murder-be_1  | 2020-06-27 22:52:41,833 INFO exited: cyrmaster (exit status 1; not expected)
murder-be_1  | 2020-06-27 22:52:41,834 INFO gave up: cyrmaster entered FATAL state, too many start retries too quickly

```

mupdate master imap.conf
```
configdirectory:        /var/lib/cyrus                                                                                                                                                            
partition-default:      /var/spool/cyrus/mail                                                                                                                                                     
admins:                 cyrus root                                                                                                                                                                
allowanonymouslogin:    no                                                                                                                                                                        
sasl_passwd_check:      shadow                                                                                                                                                                    
sasl_mech_list:         PLAIN                                                                                                                                                                     
sasl_pwcheck_method:    saslauthd                                                                                                                                                                 
sasl_auxprop_plugin:    sasldb          
```
backend imap.conf
```
onfigdirectory:        /var/lib/cyrus                                                                                                                                                            
partition-default:      /var/spool/cyrus/mail                                                                                                                                                     
servername:             murder-be.tor-hidden-services.local                                                                                                                                       
admins:                 cyrus                                                                                                                                                                     
proxyservers:           mailproxy                                                                                                                                                                 
lmtp_admins:            mailproxy                                                                                                                                                                 
mupdate_server:         169.254.67.10:3905                                                                                                                                                        
mupdate_username:       cyrus                                                                                                                                                                     
mupdate_authname:       cyrus                                                                                                                                                                     
mupdate_password:       password     
```
honestly I dont get it how this ever worked I can't even find any decent documentation on how to set it up.

**Comment by 0x00002152** [comment]
really what needs to be done is somebody who actually WANTS to do this right needs to go through and actually do it: https://www.cyrusimap.org/2.5/imap/admin/murder/murder-installation.html because this is half assed and doesn't really help anybody seems apparent whoever did it just really didn't want to.

**Comment by 0x00002152** [comment]
"In the fall of 2016 Carnegie Mellon announced the retirement of Cyrus IMAP as their electronic mail storage service, with Cyrus users required to choose between on-campus Microsoft Exchange and Google "G Suite" off-campus mail.[5]

Cyrus is still being actively developed. Carnegie Mellon University remains active in development, and also provides the infrastructure on which cyrusimap.org runs.[6] Staff at FastMail contribute much of the recent work, as they depend upon it as part of their commercial service.[7][6][8]"

I kinda wonder if it occurred to whoever dumped the cyrus imap project at CMU to try fastmail. honestly I've wondered about gmail, what project did they rip off to build it.
